product_name,product_name_citation,brand_positioning,brand_positioning_citation,visual_identity.typography,visual_identity.typography_citation,visual_identity.color,visual_identity.color_citation,visual_identity.spacing,visual_identity.spacing_citation,visual_identity.motion,visual_identity.motion_citation,ux_patterns.onboarding,ux_patterns.onboarding_citation,ux_patterns.ai_interaction,ux_patterns.ai_interaction_citation,ux_patterns.navigation,ux_patterns.navigation_citation,frontend_execution,frontend_execution_citation,clarity_score,clarity_score_citation,clarity_explanation,clarity_explanation_citation,craft_score,craft_score_citation,craft_explanation,craft_explanation_citation,cohesion_score,cohesion_score_citation,cohesion_explanation,cohesion_explanation_citation,originality_score,originality_score_citation,originality_explanation,originality_explanation_citation,trust_score,trust_score_citation,trust_explanation,trust_explanation_citation,conversion_readiness_score,conversion_readiness_score_citation,conversion_readiness_explanation,conversion_readiness_explanation_citation,emulation_feasibility,emulation_feasibility_citation
Every.to,https://every.to,A publication and product studio ecosystem for builders to stay at the edge of AI.,https://every.to,"High-quality Serif (likely Lyon) for long-form reading, paired with clean Sans-serif (Inter) for UI elements.",https://every.to,Classic monochrome palette: pure black (#000000) on white (#FFFFFF) with shades of grey for meta-data.,https://every.to,"Airy and editorial, with generous line-heights and wide margins to prioritize readability.",https://every.to,Minimalist; subtle fade-ins on page loads and clean transitions between newsletter categories.,https://every.to,Simple email-first subscription flow; 'one-click' sign-in for members via magic links.,https://every.to,"Passive; AI is the subject of content, though some interactive elements like 'Plus One' are integrated.",https://every.to,"Side-bar centric on desktop; clean top-level categories like 'Newsletter', 'Podcast', and 'Products'.",https://every.to,"Highly performant, optimized for reading; uses modern web technologies (Next.js/React) for smooth client-side navigation.",https://every.to,9,https://every.to,The value proposition is immediately clear: a premium subscription for AI builders. The site layout follows a traditional editorial grid that is easy to parse.,https://every.to,10,https://every.to,Exceptional attention to detail in typography and layout. Every element feels intentional and polished to an 'Every' standard.,https://every.to,9,https://every.to,Acts as the stylistic anchor for the entire ecosystem. The design language is consistent across all sub-pages and newsletter templates.,https://every.to,8,https://every.to,"While it follows an editorial format, the 'Every Stamp' and unique font pairings give it a distinct identity in a crowded newsletter market.",https://every.to,10,https://every.to,"High trust established via 'Trusted by 100,000 builders' social proof and high-profile testimonials. The design is professional and authoritative.",https://every.to,9,https://every.to,"Strong CTAs ('Subscribe', 'Get Started') are placed strategically throughout the site. The friction to sign up is extremely low.",https://every.to,"Moderate; while the CSS is standard, the 'Every vibe' comes from high-quality typography licenses and editorial taste that are hard to fake.",https://every.to
Spiral,https://writewithspiral.com/,An AI writing partner that interviews the user to capture their unique 'taste' and voice for social media and marketing.,https://writewithspiral.com/,Clean Sans-serif (Inter) for functional UI; monospaced fonts used for CLI instructions and code snippets.,https://writewithspiral.com/,Dark-themed interface with vibrant green/emerald accents for success states and 'Spiral' branding.,https://writewithspiral.com/,Grid-based and structured; uses card layouts to present 'Drafts' from different angles.,https://writewithspiral.com/,"Dynamic; interactive 'angles' expand on hover, and the 'interview' interface uses smooth typing animations.",https://writewithspiral.com/,Quick start via 'Get Started' or a CLI tool for developers; immediately drops users into a prompt-based workflow.,https://writewithspiral.com/,Proactive; the AI 'interviews' you with targeted questions rather than waiting for a prompt.,https://writewithspiral.com/,Single-page app feel with a focused task-based layout; minimal top-level navigation.,https://writewithspiral.com/,"Modern and fast; provides a CLI tool (`@every-env/spiral-cli`), suggesting a robust backend and developer-friendly architecture.",https://writewithspiral.com/,8,https://writewithspiral.com/,The 'AI Writing Partner' concept is well-explained through the landing page visuals. The workflow of 'Interviews' to 'Drafts' is logical.,https://writewithspiral.com/,9,https://writewithspiral.com/,"High technical craft, evidenced by the CLI integration and clean UI. The 'Angles' feature shows deep UX thinking.",https://writewithspiral.com/,8,https://writewithspiral.com/,"Shares the 'Every' stamp and minimalist philosophy, but uses a darker, more 'app-focused' palette than the main newsletter.",https://writewithspiral.com/,10,https://writewithspiral.com/,The 'interview-first' UX pattern is a highly original alternative to the generic 'chat' or 'text area' prompt models.,https://writewithspiral.com/,9,https://writewithspiral.com/,Grounded in facts with 'fact-check' indicators. The 'Property of Every' branding provides institutional trust.,https://writewithspiral.com/,8,https://writewithspiral.com/,Clear 'Get Started' buttons and developer-focused CLI options. Low barrier to entry with web and terminal options.,https://writewithspiral.com/,High; the card-based UI and dark mode are relatively easy to emulate using modern component libraries like Shadcn UI.,https://writewithspiral.com/
Cora,https://cora.computer/,An AI chief of staff for your inbox that categorizes emails and generates a daily 'Brief' to save time.,https://cora.computer/,Clean Sans-serif for productivity; uses bold headings to contrast with high-density email lists.,https://cora.computer/,Light and airy palette with blue/sky accents; uses 'clouds' as a visual metaphor for decluttering.,https://cora.computer/,Dense but organized in the 'Brief' view; uses cards to separate different email categories.,https://cora.computer/,Fluid transitions between the 'inbox' view and the 'Brief' summary; optimized for fast scanning.,https://cora.computer/,Direct inbox connection flow (OAuth); 'inbox zero' focus from the first session.,https://cora.computer/,Autonomous; Cora works in the background to categorize and summarize without active user prompting.,https://cora.computer/,"Simple dashboard with views for 'Brief', 'Categorized', and 'Settings'.",https://cora.computer/,Responsive and optimized for mobile; 'Inbox zero and a nice Brief to read instead' suggests high performance.,https://cora.computer/,9,https://cora.computer/,The chief of staff metaphor is powerful and easy to understand. The value of 'Inbox Zero' is clear and desirable.,https://cora.computer/,9,https://cora.computer/,The landing page's 'clouds' and testimonial layout show a high level of marketing craft. The product focus is very tight.,https://cora.computer/,8,https://cora.computer/,"Part of the 'Every' family, though it has a more whimsical 'sky-blue' theme than the main site's monochrome.",https://cora.computer/,9,https://cora.computer/,"While many AI email apps exist, positioning as a 'Chief of Staff' rather than just a filter is an original branding choice.",https://cora.computer/,9,https://cora.computer/,Trusted by industry leaders like Mike Krieger (Anthropic) and Andrew Wilkinson (Tiny). This social proof is exceptionally strong.,https://cora.computer/,10,https://cora.computer/,The price point ($20/mo) vs value ($150k CoS) is a compelling 'no-brainer' for the target audience. The sign-up flow is prominent.,https://cora.computer/,Moderate; the 'Brief' UI is specialized and requires significant backend AI logic to categorize correctly beyond simple UI emulation.,https://cora.computer/
Sparkle,https://makeitsparkle.co/,An AI-powered utility for Mac that declutters folders and organizes storage automatically.,https://makeitsparkle.co/,Apple-standard system fonts (San Francisco) to match the macOS aesthetic; clean and high-contrast.,https://makeitsparkle.co/,Vibrant blue and white palette with 'sparkle' icons; conveys cleanliness and digital efficiency.,https://makeitsparkle.co/,Mac-native spacing conventions; airy and familiar for desktop power users.,https://makeitsparkle.co/,Subtle desktop-level animations for folder organization; the UI feels fast and lightweight.,https://makeitsparkle.co/,"Classic Mac utility onboarding: Download DMG, drag to Applications, and notarize via Apple.",https://makeitsparkle.co/,Background AI; identifies junk files and categorizes documents without manual tagging.,https://makeitsparkle.co/,Status-bar app or simple windowed utility; focused on 'Features' and 'Download'.,https://makeitsparkle.co/,Native-feeling macOS execution; 'Notarized by Apple' and 'OpenAI certified' indicate high technical standards.,https://makeitsparkle.co/,10,https://makeitsparkle.co/,The 'Before' and 'After' folder visuals make the product's value proposition immediately obvious. Everyone understands the pain of a messy Mac.,https://makeitsparkle.co/,9,https://makeitsparkle.co/,The landing page is beautifully executed with Framer-like animations. The Apple notarization adds a layer of technical craft.,https://makeitsparkle.co/,7,https://makeitsparkle.co/,"The most 'Apple-like' of the Every products, which slightly distances it from the core monochrome 'Every' web aesthetic.",https://makeitsparkle.co/,8,https://makeitsparkle.co/,"AI file organization is a fresh take on the classic 'CleanMyMac' category, focusing on intelligence rather than just deletion.",https://makeitsparkle.co/,10,https://makeitsparkle.co/,Being 'Notarized by Apple' and 'Built by Every' provides double-layered trust for a tool with file-system access.,https://makeitsparkle.co/,9,https://makeitsparkle.co/,"A big, bold 'DOWNLOAD FOR MAC' button is the center of the page. The 10,000+ user count provides good conversion momentum.",https://makeitsparkle.co/,High; the landing page is a classic modern SaaS layout that can be easily recreated with Framer or Tailwind.,https://makeitsparkle.co/
Monologue,https://www.monologue.to/,A high-speed voice dictation and note-taking tool that transcribes and summarizes thoughts 3x faster than typing.,https://www.monologue.to/,Geometric Sans-serif; bold and modern to emphasize speed and clarity.,https://www.monologue.to/,Clean white backgrounds with a distinct orange/warm accent for the waveform and 'Monologue' icon.,https://www.monologue.to/,Very airy; focused on a single 'Wave' or 'Note' at a time to reduce distraction.,https://www.monologue.to/,Fluid; real-time waveform animations and smooth 'syncing' transitions across devices.,https://www.monologue.to/,One-button 'Download' or web access; emphasizes the 'shortest distance between talking and typing'.,https://www.monologue.to/,"Inline; AI handles transcription and style matching in real-time, learning user vocabulary.",https://www.monologue.to/,Minimal; focus is entirely on the 'Capture' button and the list of recent 'Notes'.,https://www.monologue.to/,Lightweight and fast; built with a focus on low-latency transcription and cross-device sync.,https://www.monologue.to/,9,https://www.monologue.to/,The '3x faster' claim and the 'talking vs typing' headline are very clear. The visual waveform reinforces the audio focus.,https://www.monologue.to/,9,https://www.monologue.to/,The use of Framer for the landing page ensures high-quality motion and responsiveness. The cross-device sync is a hallmark of good craft.,https://www.monologue.to/,8,https://www.monologue.to/,"Shares the 'Every' ecosystem branding ('Included in Every subscription'), with a slightly more 'tech-tool' aesthetic.",https://www.monologue.to/,7,https://www.monologue.to/,"While AI transcription is common (Otter, etc.), Monologue's focus on 'perfect voice dictation' for writing is a strong niche play.",https://www.monologue.to/,9,https://www.monologue.to/,"Endorsed by Julien Chaumond (Hugging Face), adding significant technical credibility. The connection to Every further bolsters trust.",https://www.monologue.to/,8,https://www.monologue.to/,Clear 'Download' buttons and a 'Watch Video' explainer. The value proposition for writers is immediate.,https://www.monologue.to/,"Moderate; while the UI is simple, the real-time waveform and low-latency transcription are technically challenging to emulate perfectly.",https://www.monologue.to/
Proof,https://proofeditor.ai/,"A minimalist, no-login document editor built for humans and AI agents (like Claw or Claude) to collaborate in real-time.",https://proofeditor.ai/,Inter (Sans-serif) for high legibility; focuses on a 'clean sheet' writing environment.,https://proofeditor.ai/,Strict monochrome; white background with black text and simple grey borders.,https://proofeditor.ai/,Very tight and focused; removes all UI chrome to maximize the writing area.,https://proofeditor.ai/,Instantaneous; no transitions or animations to maintain a sense of speed and 'no-bloat'.,https://proofeditor.ai/,Zero-friction; users can start a new doc in 10 seconds without creating an account.,https://proofeditor.ai/,Agent-centric; built specifically to be 'pasted into any AI agent' for collaborative editing.,https://proofeditor.ai/,Almost non-existent; single-doc focus with shareable links as the primary navigation model.,https://proofeditor.ai/,Extremely fast and lightweight; provides a SDK (`proof-sdk`) for developers to integrate document editing into their own AI apps.,https://proofeditor.ai/,10,https://proofeditor.ai/,The 'Start in 10 seconds' promise is delivered. The tool does exactly one thing (doc editing for agents) with zero confusion.,https://proofeditor.ai/,9,https://proofeditor.ai/,The craft is in the 'subtraction' - removing all unnecessary features to create the fastest possible editor. The open-source SDK is a nice touch.,https://proofeditor.ai/,10,https://proofeditor.ai/,Perfectly aligns with the 'Every' minimalist aesthetic. The 'MADE BY Every' stamp is clearly integrated.,https://proofeditor.ai/,9,https://proofeditor.ai/,The focus on 'Agent-Human Collaboration' is a unique and forward-looking pivot in the document editor space.,https://proofeditor.ai/,8,https://proofeditor.ai/,No-login makes it feel 'throwaway' but the Every branding and GitHub presence (open source) provide the necessary trust for professional use.,https://proofeditor.ai/,9,https://proofeditor.ai/,The CTA is 'Get Started' and the barrier is literally zero. Extremely high conversion potential for quick tasks.,https://proofeditor.ai/,Extremely High; the UI is intentionally simple and can be recreated in minutes using basic HTML/CSS.,https://proofeditor.ai/
Plus One,https://every.to/plus-one,An AI-powered social promotion tool that helps Every readers 'promote themselves' by generating custom ad copy.,https://every.to/plus-one,Shares the main Every.to Inter/Serif stack; feels like a native extension of the newsletter.,https://every.to/plus-one,Monochrome with the 'OpenClaw' icon; consistent with the Every Studio sub-branding.,https://every.to/plus-one,Integrated into the newsletter layout; uses sidebar or inline sections.,https://every.to/plus-one,Minimal; focuses on static copy generation with simple loading states.,https://every.to/plus-one,Integrated for existing Every subscribers; no separate sign-up required.,https://every.to/plus-one,Generative; takes user input about their project and generates promotion-ready text.,https://every.to/plus-one,Navigated via the Every.to 'Products' menu or direct links from the newsletter.,https://every.to/plus-one,Lightweight React/Next.js implementation; integrated directly into the Every.to domain infrastructure.,https://every.to/plus-one,8,https://every.to/plus-one,"The concept of a 'Plus One' (an ad in the newsletter) is clear to the Every audience, though new visitors might need more context.",https://every.to/plus-one,8,https://every.to/plus-one,Solid utility craft; the tool solves a specific problem for the Every ecosystem's community members efficiently.,https://every.to/plus-one,10,https://every.to/plus-one,Complete cohesion with the parent brand as it lives on the same domain and uses the exact same design tokens.,https://every.to/plus-one,8,https://every.to/plus-one,Using AI to help readers write their own ads for a newsletter is a unique way to engage a community and automate sponsorship.,https://every.to/plus-one,9,https://every.to/plus-one,"Inherits trust directly from the main Every.to brand. Users trust the newsletter, so they trust the promo tool.",https://every.to/plus-one,8,https://every.to/plus-one,Conversion is focused on current readers. The flow to 'Get an OpenClaw' is direct.,https://every.to/plus-one,High; simple form-to-copy generation UI.,https://every.to/plus-one
Lex,https://every.to/on-every/introducing-lex,"The ultimate AI-powered word processor for writers, designed to eliminate writer's block and streamline the creative process.",https://every.to/on-every/introducing-lex,Premium Serif for the editor (Lyon); Inter for the UI. Focuses on the beauty of the written word.,https://every.to/on-every/introducing-lex,"Clean, distraction-free white background with a minimal, elegant cursor and black text.",https://every.to/on-every/introducing-lex,Generous margins and whitespace; designed to feel like a high-end physical stationery set.,https://every.to/on-every/introducing-lex,Subtle; focus is on the 'AI typing' effect and smooth document saving indicators.,https://every.to/on-every/introducing-lex,Waitlist-based initially (viral growth); now direct 'Sign Up' with a focus on immediate writing.,https://every.to/on-every/introducing-lex,Inline and contextual; use '+++' to have Lex continue your thought or 'Check' for feedback.,https://every.to/on-every/introducing-lex,Document-centric; a sidebar for folders and a main stage for the current doc.,https://every.to/on-every/introducing-lex,Highly polished; custom editor engine built for low latency and AI integration. Spun out as a standalone company.,https://every.to/on-every/introducing-lex,9,https://every.to/on-every/introducing-lex,The 'Google Docs with AI' pitch is perfect. Anyone who writes immediately understands the value of Lex.,https://every.to/on-every/introducing-lex,10,https://every.to/on-every/introducing-lex,Exquisite editorial craft. Lex pioneered the 'AI-first editor' aesthetic that many others have since copied.,https://every.to/on-every/introducing-lex,8,https://every.to/on-every/introducing-lex,Shares the 'Every roots' design DNA but has evolved its own distinct brand identity as it spun out.,https://every.to/on-every/introducing-lex,10,https://every.to/on-every/introducing-lex,The '+++' trigger and the idea of an 'AI writing partner' rather than a 'prompt bot' were highly original at launch.,https://every.to/on-every/introducing-lex,9,https://every.to/on-every/introducing-lex,Massive trust from the 'Every' community and viral adoption by high-profile writers and journalists.,https://every.to/on-every/introducing-lex,9,https://every.to/on-every/introducing-lex,Viral 'share link' loops and a focus on getting users to type their first word make for excellent conversion.,https://every.to/on-every/introducing-lex,"Moderate; while the UI is simple, building a high-performance rich-text editor with AI context is a significant engineering feat.",https://every.to/on-every/introducing-lex